ID,Slug,Author,Published Date,Keywords,Meta Description
vKRd1cp2y,"semantic-seo-ai-agents-entity-relationships","Ryan Walker","2024-11-01","Avakata, revenue operations, SEO, search engine optimization, AI, artificial intelligence, AI agents, autonomous agents","Keywords are dead; entities are the new currency. Search engines now function as answer engines......"
Jjq5G73oW,"autonomous-technical-seo-self-healing-sweeps","Ryan Walker","2024-11-08","Avakata, revenue operations, SEO, search engine optimization","Traditional SEO involves monthly or quarterly audits. A human consultant runs a crawl......"
iwi1Mbilg,"predictive-ranking-forecasting-algorithm-shifts","Ryan Walker","2024-11-15","Avakata, revenue operations, SEO, search engine optimization","Most SEOs react to Google Core Updates after they happen. They scramble to fix sites......"
DWhDiY60R,"agentic-stack-orchestrating-multi-channel-autonomous-agents","Ryan Walker","2024-11-22","Avakata, revenue operations, AI agents, autonomous agents","We have moved beyond Chatbots to Agents. An agent has permission to do things......"
ZGn5AKwB5,"machine-learning-content-decay-auto-refreshing-backlog","Ryan Walker","2024-11-29","Avakata, revenue operations, content marketing, content strategy","Content Decay occurs when older posts gradually lose traffic as they become outdated......"
j77PJGwOE,"beyond-keywords-llms-user-intent-modeling","Ryan Walker","2024-12-06","Avakata, revenue operations","User Intent is why someone searches. Navigational, Informational, Transactional......"
nTTY2U2Jv,"generative-creative-multivariate-testing-scale","Ryan Walker","2024-12-13","Avakata, revenue operations, PPC, paid advertising","In traditional PPC, testing 10 different ad creatives requires a designer to make 10 different images......"
x9kRHGs2H,"real-time-bid-optimization-ai-agents-maximize-roas","Ryan Walker","2024-12-20","Avakata, revenue operations, AI, artificial intelligence, AI agents, autonomous agents","Manual bid management is dead. By the time a human analyzes yesterday's data and adjusts bids......"
d_BztjJps,"cro-automation-always-on-ab-testing","Ryan Walker","2024-12-27","Avakata, revenue operations, CRO, conversion optimization","Conversion Rate Optimization (CRO) is traditionally a slow, manual process......"
OILDCzTS4,"generative-chat-agents-inbound-lead-qualification","Ryan Walker","2025-01-03","Avakata, revenue operations, AI agents, autonomous agents","Most inbound leads are tire-kickers. Your sales team wastes hours on discovery calls......"
MS2gfIx0W,"predictive-analytics-forecasting-revenue-machine-learning","Ryan Walker","2025-01-10","Avakata, revenue operations, analytics, predictive analytics","Most businesses look at historical data to make decisions. Last quarter, we did X......"
UbJji5beM,"marketing-mix-modeling-ai-powered-budget-allocation","Ryan Walker","2025-01-17","Avakata, revenue operations, AI, artificial intelligence, CRO, conversion optimization, digital marketing, marketing automation","Most marketers allocate budgets based on gut feel or last year's spend......"